{
  "$schema": "https://json-schema.org/draft/2020-12/schema",
  "title": "Pocket Genes platform object record fixture",
  "description": "Platform identity and lifecycle data surrounding strict standalone PGO domain content. This is not the JSON a person uploads.",
  "type": "object",
  "properties": {
    "object_id": {
      "type": "string",
      "minLength": 1,
      "pattern": "\\S",
      "description": "Platform-managed object identity."
    },
    "object_type": {
      "type": "string",
      "enum": [
        "pgo_form",
        "pgo_bundle_of_symptoms",
        "pgo_bundle_of_candidate_genes",
        "pgo_informed_consent",
        "pgo_test_order",
        "pgo_collection_request",
        "pgo_blood_sample",
        "pgo_tissue_sample",
        "pgo_embryo_sample",
        "pgo_dna_sample",
        "pgo_sequence_reads",
        "pgo_sequence_data",
        "pgo_aligned_reads",
        "pgo_unannotated_vcf",
        "pgo_annotated_vcf",
        "pgo_interactive_report",
        "pgo_pdf_report",
        "pgo_image_bundle",
        "pgo_karyotype_result",
        "pgo_flow_cytometry_data"
      ],
      "description": "Registered PGO type selected outside the content."
    },
    "schema_version": {
      "const": "1.0.0"
    },
    "revision": {
      "type": "integer",
      "minimum": 1
    },
    "created_at": {
      "type": "string",
      "format": "date-time"
    },
    "created_by": {
      "type": "string",
      "minLength": 1,
      "pattern": "\\S",
      "description": "Platform-managed creator identity."
    },
    "data": {
      "type": "object",
      "description": "Strict PGO content validated against object_type."
    }
  },
  "required": [
    "object_id",
    "object_type",
    "schema_version",
    "revision",
    "created_at",
    "created_by",
    "data"
  ],
  "additionalProperties": false
}
