{
  "object_id": "obj_demo_whole_embryo",
  "object_type": "pgo_embryo_sample",
  "schema_version": "1.0.0",
  "revision": 1,
  "created_at": "2026-09-16T12:20:00Z",
  "created_by": "platform_demo_import",
  "data": {
    "sample_label": "DEMO-WHOLE-EMBRYO-001",
    "material_kind": "whole_embryo",
    "embryo_identifier": "EMBRYO-DEMO-001"
  }
}
