{
  "object_id": "obj_demo_form_test_ordering",
  "object_type": "pgo_form",
  "schema_version": "1.0.0",
  "revision": 1,
  "created_at": "2026-09-16T12:11:00Z",
  "created_by": "user_demo_001",
  "data": {
    "form_shape": {
      "fields": [
        {
          "key": "patient",
          "label": "Patient or source",
          "type": "text",
          "required": true
        },
        {
          "key": "test_name",
          "label": "Requested test name",
          "type": "text",
          "required": true
        },
        {
          "key": "sample_type",
          "label": "Requested specimen",
          "type": "enum",
          "required": true,
          "options": [
            {
              "value": "blood",
              "label": "Blood"
            },
            {
              "value": "dried_blood_spot",
              "label": "Dried blood spot"
            },
            {
              "value": "saliva",
              "label": "Saliva"
            },
            {
              "value": "buccal_swab",
              "label": "Buccal swab"
            },
            {
              "value": "tissue",
              "label": "Tissue"
            },
            {
              "value": "skin_biopsy",
              "label": "Skin biopsy"
            },
            {
              "value": "bone_marrow_aspirate",
              "label": "Bone marrow aspirate"
            },
            {
              "value": "bone_marrow_core",
              "label": "Bone marrow core biopsy"
            },
            {
              "value": "amniotic_fluid",
              "label": "Amniotic fluid"
            },
            {
              "value": "chorionic_villi",
              "label": "Chorionic villi"
            },
            {
              "value": "cord_blood",
              "label": "Cord blood"
            },
            {
              "value": "cerebrospinal_fluid",
              "label": "Cerebrospinal fluid"
            },
            {
              "value": "urine",
              "label": "Urine"
            },
            {
              "value": "stool",
              "label": "Stool"
            },
            {
              "value": "hair_follicles",
              "label": "Hair follicles"
            },
            {
              "value": "nail_clippings",
              "label": "Nail clippings"
            },
            {
              "value": "semen",
              "label": "Semen"
            },
            {
              "value": "embryo_biopsy",
              "label": "Embryo biopsy"
            },
            {
              "value": "whole_embryo",
              "label": "Whole embryo"
            },
            {
              "value": "polar_body",
              "label": "Polar body"
            },
            {
              "value": "plasma",
              "label": "Plasma"
            },
            {
              "value": "serum",
              "label": "Serum"
            },
            {
              "value": "extracted_dna",
              "label": "Extracted DNA"
            },
            {
              "value": "extracted_rna",
              "label": "Extracted RNA"
            },
            {
              "value": "other",
              "label": "Other"
            }
          ]
        },
        {
          "key": "test_type",
          "label": "Broad test type",
          "type": "enum",
          "required": false,
          "options": [
            {
              "value": "single_gene",
              "label": "Single-gene test"
            },
            {
              "value": "gene_panel",
              "label": "Gene panel"
            },
            {
              "value": "exome_sequencing",
              "label": "Exome sequencing"
            },
            {
              "value": "genome_sequencing",
              "label": "Genome sequencing"
            },
            {
              "value": "targeted_variant_testing",
              "label": "Targeted variant testing"
            },
            {
              "value": "repeat_expansion_testing",
              "label": "Repeat expansion testing"
            },
            {
              "value": "methylation_analysis",
              "label": "Methylation analysis"
            },
            {
              "value": "chromosomal_microarray",
              "label": "Chromosomal microarray"
            },
            {
              "value": "karyotype",
              "label": "Karyotype"
            },
            {
              "value": "fish",
              "label": "FISH"
            },
            {
              "value": "other",
              "label": "Other"
            }
          ]
        },
        {
          "key": "objective",
          "label": "Objective",
          "type": "long_text",
          "required": false
        },
        {
          "key": "clinical_suspicion",
          "label": "Clinical suspicion",
          "type": "long_text",
          "required": false
        },
        {
          "key": "genes",
          "label": "Genes",
          "type": "string_list",
          "required": false
        }
      ]
    },
    "fields": [
      {
        "key": "patient",
        "value": "Patient AB-123"
      },
      {
        "key": "test_name",
        "value": "Hereditary cancer panel"
      },
      {
        "key": "sample_type",
        "value": "blood"
      },
      {
        "key": "test_type",
        "value": "gene_panel"
      },
      {
        "key": "objective",
        "value": "Evaluate an inherited cancer predisposition."
      },
      {
        "key": "genes",
        "value": [
          "BRCA1",
          "BRCA2"
        ]
      }
    ]
  }
}
