{
  "object_id": "obj_demo_form_gene_prioritization",
  "object_type": "pgo_form",
  "schema_version": "1.0.0",
  "revision": 1,
  "created_at": "2026-09-16T12:06:00Z",
  "created_by": "user_demo_001",
  "data": {
    "form_shape": {
      "fields": [
        {
          "key": "ranking_mode",
          "label": "Result organization",
          "type": "enum",
          "required": true,
          "options": [
            {
              "value": "ranked",
              "label": "Ranked list"
            },
            {
              "value": "selected",
              "label": "Selected set"
            }
          ]
        },
        {
          "key": "maximum_genes",
          "label": "Maximum genes",
          "type": "positive_integer",
          "required": true
        }
      ]
    },
    "fields": [
      {
        "key": "ranking_mode",
        "value": "ranked"
      },
      {
        "key": "maximum_genes",
        "value": 3
      }
    ]
  }
}
