{
  "object_id": "obj_demo_form_interactive_interpretation",
  "object_type": "pgo_form",
  "schema_version": "1.0.0",
  "revision": 1,
  "created_at": "2026-09-17T15:05:00Z",
  "created_by": "user_demo_001",
  "data": {
    "form_shape": {
      "fields": [
        {
          "key": "interpretation_profile",
          "label": "Interactive report profile",
          "type": "enum",
          "required": true,
          "options": [
            {
              "value": "pg_demo_mdm_pgi1_v1",
              "label": "Demo PGI1 MDMAPIModel profile"
            }
          ]
        }
      ]
    },
    "fields": [
      {
        "key": "interpretation_profile",
        "value": "pg_demo_mdm_pgi1_v1"
      }
    ]
  }
}
