{
  "object_id": "obj_demo_form_dna_extraction",
  "object_type": "pgo_form",
  "schema_version": "1.0.0",
  "revision": 1,
  "created_at": "2026-09-16T15:05:00Z",
  "created_by": "user_demo_001",
  "data": {
    "form_shape": {
      "fields": [
        {
          "key": "extraction_profile",
          "label": "Extraction profile",
          "type": "enum",
          "required": true,
          "options": [
            {
              "value": "demo_blood_dna_v1",
              "label": "Demo blood DNA extraction"
            },
            {
              "value": "demo_tissue_dna_v1",
              "label": "Demo tissue DNA extraction"
            },
            {
              "value": "demo_embryo_biopsy_dna_v1",
              "label": "Demo embryo-biopsy DNA extraction"
            }
          ]
        }
      ]
    },
    "fields": [
      {
        "key": "extraction_profile",
        "value": "demo_blood_dna_v1"
      }
    ]
  }
}
