{
  "object_id": "obj_demo_blood",
  "object_type": "pgo_blood_sample",
  "schema_version": "1.0.0",
  "revision": 3,
  "created_at": "2026-09-16T16:00:00Z",
  "created_by": "pgp_precision_lab",
  "data": {
    "sample_label": "DEMO-SAMPLE-001",
    "material": "whole_blood",
    "container": "edta_tube",
    "volume_ml": 2
  }
}
